{
  "schema_version": "1.0",
  "project_id": "project.vibehub",
  "generated_at": "2026-07-11T08:00:00.000Z",
  "model_version": "model.fixture.1",
  "freshness": "fresh",
  "completeness": "complete",
  "evidence_refs": [
    {
      "evidence_id": "ev.fixture",
      "kind": "test",
      "grade": "hard_observed",
      "label_key": "evidence.fixture.generated",
      "locator": "fixtures/v3/ev.fixture",
      "captured_at": "2026-07-11T08:00:00.000Z"
    }
  ],
  "warnings": [],
  "errors": [],
  "task_id": "task.m0",
  "node_id": "node.contracts",
  "workflow_profile": "full",
  "execution_policy": {
    "recommended_profile": "full",
    "effective_profile": "full",
    "policy_version": 1,
    "enforcement_epoch": "v3.1-hard-closure",
    "trigger_reasons": [
      "fixture:full"
    ],
    "override_record": null,
    "upgrade_history": [],
    "milestone_policy": "full",
    "planning_required": true,
    "review_required": true,
    "required_records": [
      "plan",
      "session",
      "progress",
      "result",
      "review"
    ]
  },
  "goal": "冻结契约与 TypeScript 类型",
  "scope": [
    "src/v3/contracts/generated/*.ts",
    "src/v3/contracts/fixtureRepository.ts",
    "src/v3/contracts/index.ts"
  ],
  "non_scope": [
    "V3 event store",
    "M1 UI 组件",
    "M2 MCP 控制面"
  ],
  "dependencies": [
    "node.schema",
    "node.fixtures"
  ],
  "accepted_decisions": [
    "JSON Schema 2020-12 作为规范格式",
    "Fixture-first 策略隔离 M1 与 V2",
    "确定性种子 20260711 保证可复现"
  ],
  "project_memory": [],
  "protocol_records": [
    {
      "record": "plan",
      "status": "complete",
      "repair_action": null
    },
    {
      "record": "session",
      "status": "complete",
      "repair_action": null
    },
    {
      "record": "progress",
      "status": "complete",
      "repair_action": null
    },
    {
      "record": "result",
      "status": "complete",
      "repair_action": null
    },
    {
      "record": "review",
      "status": "complete",
      "repair_action": null
    }
  ],
  "coverage_mode": "enforced",
  "completion_gate": {
    "all_passed": true,
    "blocked_chain": [],
    "items": [
      {
        "gate": "plan_terminal",
        "status": "satisfied",
        "passed": true,
        "reason_code": "completion.plan_terminal",
        "summary": "plan_terminal satisfied",
        "expected_state": "plan_terminal satisfied",
        "observed_state": "plan_terminal satisfied",
        "satisfied_facts": [
          "plan_terminal satisfied"
        ],
        "missing_facts": [],
        "blocker_ids": [],
        "repair_actions": []
      },
      {
        "gate": "sessions_settled",
        "status": "satisfied",
        "passed": true,
        "reason_code": "completion.sessions_settled",
        "summary": "sessions_settled satisfied",
        "expected_state": "sessions_settled satisfied",
        "observed_state": "sessions_settled satisfied",
        "satisfied_facts": [
          "sessions_settled satisfied"
        ],
        "missing_facts": [],
        "blocker_ids": [],
        "repair_actions": []
      },
      {
        "gate": "results_terminal",
        "status": "satisfied",
        "passed": true,
        "reason_code": "completion.results_terminal",
        "summary": "results_terminal satisfied",
        "expected_state": "results_terminal satisfied",
        "observed_state": "results_terminal satisfied",
        "satisfied_facts": [
          "results_terminal satisfied"
        ],
        "missing_facts": [],
        "blocker_ids": [],
        "repair_actions": []
      },
      {
        "gate": "criteria_green",
        "status": "satisfied",
        "passed": true,
        "reason_code": "completion.criteria_green",
        "summary": "criteria_green satisfied",
        "expected_state": "criteria_green satisfied",
        "observed_state": "criteria_green satisfied",
        "satisfied_facts": [
          "criteria_green satisfied"
        ],
        "missing_facts": [],
        "blocker_ids": [],
        "repair_actions": []
      },
      {
        "gate": "findings_closed",
        "status": "satisfied",
        "passed": true,
        "reason_code": "completion.findings_closed",
        "summary": "findings_closed satisfied",
        "expected_state": "findings_closed satisfied",
        "observed_state": "findings_closed satisfied",
        "satisfied_facts": [
          "findings_closed satisfied"
        ],
        "missing_facts": [],
        "blocker_ids": [],
        "repair_actions": []
      }
    ]
  },
  "research_summary": [
    "调查了 JSON Schema 2020-12 vs OpenAPI 3.1，选择前者因为 AJV2020 支持更好",
    "Fixture-first 隔离 M1 前端开发与 V2 后端耦合",
    "12 场景覆盖正常/异常/边界/大数据/跨平台路径"
  ],
  "criteria": [
    {
      "criterion_id": "criterion.m0.c01",
      "title": "Schema hash stability",
      "status": "passed",
      "required": true,
      "evidence_refs": [
        {
          "evidence_id": "ev.criterion.m0.c01",
          "kind": "test",
          "grade": "hard_observed",
          "label_key": "evidence.fixture.generated",
          "locator": "fixtures/v3/ev.criterion.m0.c01",
          "captured_at": "2026-07-11T08:00:00.000Z"
        }
      ]
    },
    {
      "criterion_id": "criterion.m0.c02",
      "title": "All views validate against schema",
      "status": "passed",
      "required": true,
      "evidence_refs": [
        {
          "evidence_id": "ev.criterion.m0.c02",
          "kind": "test",
          "grade": "hard_observed",
          "label_key": "evidence.fixture.generated",
          "locator": "fixtures/v3/ev.criterion.m0.c02",
          "captured_at": "2026-07-11T08:00:00.000Z"
        }
      ]
    },
    {
      "criterion_id": "criterion.m0.c07",
      "title": "Fixture repository consumer proof",
      "status": "passed",
      "required": true,
      "evidence_refs": [
        {
          "evidence_id": "ev.criterion.m0.c07",
          "kind": "test",
          "grade": "hard_observed",
          "label_key": "evidence.fixture.generated",
          "locator": "fixtures/v3/ev.criterion.m0.c07",
          "captured_at": "2026-07-11T08:00:00.000Z"
        }
      ]
    }
  ],
  "files": [
    {
      "platform": "macos",
      "native": "/Users/alex/Projects/VibeHub/src/v3/contracts/index.ts",
      "display": "/Users/alex/Projects/VibeHub/src/v3/contracts/index.ts",
      "identity_key": "macos:/Users/alex/Projects/VibeHub/src/v3/contracts/index.ts",
      "path_kind": "absolute",
      "accessible": true
    },
    {
      "platform": "macos",
      "native": "/Users/alex/Projects/VibeHub/src/v3/contracts/fixtureRepository.ts",
      "display": "/Users/alex/Projects/VibeHub/src/v3/contracts/fixtureRepository.ts",
      "identity_key": "macos:/Users/alex/Projects/VibeHub/src/v3/contracts/fixtureRepository.ts",
      "path_kind": "absolute",
      "accessible": true
    },
    {
      "platform": "macos",
      "native": "/Users/alex/Projects/VibeHub/src/v3/contracts/generated/index.ts",
      "display": "/Users/alex/Projects/VibeHub/src/v3/contracts/generated/index.ts",
      "identity_key": "macos:/Users/alex/Projects/VibeHub/src/v3/contracts/generated/index.ts",
      "path_kind": "absolute",
      "accessible": true
    },
    {
      "platform": "macos",
      "native": "/Users/alex/Projects/VibeHub/src/v3/contracts/generated/project-overview-view.ts",
      "display": "/Users/alex/Projects/VibeHub/src/v3/contracts/generated/project-overview-view.ts",
      "identity_key": "macos:/Users/alex/Projects/VibeHub/src/v3/contracts/generated/project-overview-view.ts",
      "path_kind": "absolute",
      "accessible": true
    },
    {
      "platform": "macos",
      "native": "/Users/alex/Projects/VibeHub/src/v3/contracts/generated/project-structure-view.ts",
      "display": "/Users/alex/Projects/VibeHub/src/v3/contracts/generated/project-structure-view.ts",
      "identity_key": "macos:/Users/alex/Projects/VibeHub/src/v3/contracts/generated/project-structure-view.ts",
      "path_kind": "absolute",
      "accessible": true
    },
    {
      "platform": "macos",
      "native": "/Users/alex/Projects/VibeHub/src/v3/contracts/generated/task-timeline-view.ts",
      "display": "/Users/alex/Projects/VibeHub/src/v3/contracts/generated/task-timeline-view.ts",
      "identity_key": "macos:/Users/alex/Projects/VibeHub/src/v3/contracts/generated/task-timeline-view.ts",
      "path_kind": "absolute",
      "accessible": true
    },
    {
      "platform": "macos",
      "native": "/Users/alex/Projects/VibeHub/src/v3/contracts/generated/plan-graph-view.ts",
      "display": "/Users/alex/Projects/VibeHub/src/v3/contracts/generated/plan-graph-view.ts",
      "identity_key": "macos:/Users/alex/Projects/VibeHub/src/v3/contracts/generated/plan-graph-view.ts",
      "path_kind": "absolute",
      "accessible": true
    },
    {
      "platform": "macos",
      "native": "/Users/alex/Projects/VibeHub/src/v3/contracts/generated/node-brief.ts",
      "display": "/Users/alex/Projects/VibeHub/src/v3/contracts/generated/node-brief.ts",
      "identity_key": "macos:/Users/alex/Projects/VibeHub/src/v3/contracts/generated/node-brief.ts",
      "path_kind": "absolute",
      "accessible": true
    }
  ],
  "validation_commands": [
    "npm run v3:contracts:check",
    "npm run v3:contracts:generate"
  ],
  "state": "active",
  "next_intent": "完成 M0 交付物冻结，进入 M1 fixture-driven 前端开发",
  "budget": {
    "max_tokens": 8000,
    "estimated_tokens": 3200,
    "truncated_sections": []
  },
  "source_versions": {
    "contract": "1.0",
    "model": "model.fixture.1",
    "json-schema": "2020-12"
  },
  "protocol_coverage": "complete"
}
